Job Id,Experience,Qualifications,Salary Range,location,Country,latitude,longitude,Work Type,Company Size,Job Posting Date,Preference,Contact Person,Contact,Job Title,Role,Job Portal,Job Description,Benefits,skills,Responsibilities,Company,Company Profile
1,5 to 15 Years,M.Tech,$59K-$99K,Douglas,Isle of Man,54.2361,-4.5481,Intern,26801,2022-04-24,Female,Brandon Cunningham,001-381-930-7517x737,Digital Marketing Specialist,Social Media Manager,Snagajob,"Social Media Managers oversee an organizations social media presence. They create and schedule content, engage with followers, and analyze social media metrics to drive brand awareness and engagement.","{'Flexible Spending Accounts (FSAs), Relocation Assistance, Legal Assistance, Employee Recognition Programs, Financial Counseling'}","Social media platforms (e.g., Facebook, Twitter, Instagram) Content creation and scheduling Social media analytics and insights Community engagement Paid social advertising","Manage and grow social media accounts, create engaging content, and interact with the online community. Develop social media content calendars and strategies. Monitor social media trends and engagement metrics.",Icahn Enterprises,"{""Sector"":""Diversified"",""Industry"":""Diversified Financials"",""City"":""Sunny Isles Beach"",""State"":""Florida"",""Zip"":""33160"",""Website"":""www.ielp.com"",""Ticker"":""IEP"",""CEO"":""David Willetts""}"
2,2 to 12 Years,BCA,$56K-$116K,Ashgabat,Turkmenistan,38.9697,59.5563,Intern,100340,2022-12-19,Female,Francisco Larsen,461-509-4216,Web Developer,Frontend Web Developer,Idealist,"Frontend Web Developers design and implement user interfaces for websites, ensuring they are visually appealing and user-friendly. They collaborate with designers and backend developers to create seamless web experiences for users.","{'Health Insurance, Retirement Plans, Paid Time Off (PTO), Flexible Work Arrangements, Employee Assistance Programs (EAP)'}","HTML, CSS, JavaScript Frontend frameworks (e.g., React, Angular) User experience (UX)","Design and code user interfaces for websites, ensuring a seamless and visually appealing user experience. Collaborate with UX designers to optimize user journeys. Ensure cross-browser compatibility and responsive design.",PNC Financial Services Group,"{""Sector"":""Financial Services"",""Industry"":""Commercial Banks"",""City"":""Pittsburgh"",""State"":""Pennsylvania"",""Zip"":""15222"",""Website"":""www.pnc.com"",""Ticker"":""PNC"",""CEO"":""William S. Demchak""}"
3,0 to 12 Years,PhD,$61K-$104K,Macao,"Macao SAR, China",22.1987,113.5439,Temporary,84525,2022-09-14,Male,Gary Gibson,9687619505,Operations Manager,Quality Control Manager,Jobs2Careers,"Quality Control Managers establish and enforce quality standards within an organization. They develop quality control processes, perform inspections, and implement corrective actions to maintain product or service quality.","{'Legal Assistance, Bonuses and Incentive Programs, Wellness Programs, Employee Discounts, Retirement Plans'}","Quality control processes and methodologies Statistical process control (SPC) Root cause analysis and corrective action Quality management systems (e.g., ISO 9001) Compliance and regulatory knowledge",Establish and enforce quality control standards and procedures. Conduct quality audits and inspections. Collaborate with production teams to address quality issues and implement improvements.,United Services Automobile Assn.,"{""Sector"":""Insurance"",""Industry"":""Insurance: Property and Casualty (Stock)"",""City"":""San Antonio"",""State"":""Texas"",""Zip"":""78288"",""Website"":""www.usaa.com"",""Ticker"":"""",""CEO"":""Wayne Peacock""}"
4,4 to 11 Years,PhD,$65K-$91K,Porto-Novo,Benin,9.3077,2.3158,Full-Time,129896,2023-02-25,Female,Joy Lucero,+1-820-643-5431x47576,Network Engineer,Wireless Network Engineer,FlexJobs,"Wireless Network Engineers design, implement, and maintain wireless network solutions. They optimize wireless connectivity, troubleshoot issues, and ensure reliable and secure wireless communications.","{'Transportation Benefits, Professional Development, Bonuses and Incentive Programs, Profit-Sharing, Employee Discounts'}",Wireless network design and architecture Wi-Fi standards and protocols RF (Radio Frequency) planning and optimization Wireless security protocols Troubleshooting wireless network issues,"Design, configure, and optimize wireless networks, ensuring reliable and secure wireless connectivity. Troubleshoot wireless network issues. Plan and implement wireless network upgrades.",Hess,"{""Sector"":""Energy"",""Industry"":""Mining, Crude-Oil Production"",""City"":""New York"",""State"":""New York"",""Zip"":""10036"",""Website"":""www.hess.com"",""Ticker"":""HES"",""CEO"":""John B. Hess""}"
5,1 to 12 Years,MBA,$64K-$87K,Santiago,Chile,-35.6751,-71.5429,Intern,53944,2022-10-11,Female,Julie Johnson,343.975.4702x9340,Event Manager,Conference Manager,Jobs2Careers,"A Conference Manager coordinates and manages conferences, meetings, and events. They plan logistics, handle budgeting, liaise with vendors, and ensure the smooth execution of events, catering to the needs and expectations of attendees.","{'Flexible Spending Accounts (FSAs), Relocation Assistance, Legal Assistance, Employee Recognition Programs, Financial Counseling'}",Event planning Conference logistics Budget management Vendor coordination Marketing and promotion Client relations,"Specialize in conference and convention planning. Coordinate speaker sessions, exhibitors, and attendee experiences. Oversee event registration and marketing.",Cairn Energy,"{""Sector"":""Energy"",""Industry"":""Energy - Oil & Gas Exploration & Production"",""City"":""Edinburgh"",""State"":""Scotland"",""Zip"":""EH2 4NH"",""Website"":""https://www.cairnenergy.com/"",""Ticker"":""CNE"",""CEO"":""Simon Thomson""}"
6,4 to 12 Years,MCA,$59K-$93K,Brussels,Belgium,50.5039,4.4699,Full-Time,23196,2023-07-25,Male,Matthew Gill,(973)791-5355x52199,Software Tester,Quality Assurance Analyst,Snagajob,"A Quality Assurance Analyst tests software and products to ensure they meet quality standards. They identify defects, report issues, and work with development teams to resolve problems.","{'Life and Disability Insurance, Stock Options or Equity Grants, Employee Recognition Programs, Health Insurance, Social and Recreational Activities'}","Quality assurance processes Testing methodologies (e.g., manual, automated) Bug tracking and reporting Test case development Regression testing","Test software applications and systems to identify defects and ensure quality. Create test plans, test cases, and test scripts. Collaborate with development teams to resolve issues.",Adani Ports and Special Economic Zone,"{""Sector"":""Infrastructure"",""Industry"":""Ports and Infrastructure"",""City"":""Mundra"",""State"":""Gujarat"",""Zip"":""370421"",""Website"":""https://www.adaniports.com/"",""Ticker"":""ADANIPORTS"",""CEO"":""Karan Adani""}"
7,3 to 15 Years,PhD,$63K-$103K,George Town,Cayman Islands,19.3133,-81.2546,Temporary,26119,2023-04-10,Both,Zachary Hansen,001-268-510-4362x789,Teacher,Classroom Teacher,FlexJobs,"A Classroom Teacher educates students in a specific subject or grade level. They create lesson plans, deliver instruction, assess student progress, and foster a positive learning environment.","{'Flexible Spending Accounts (FSAs), Relocation Assistance, Legal Assistance, Employee Recognition Programs, Financial Counseling'}",Teaching pedagogy Classroom management Curriculum development Student assessment Differentiated instruction,"Plan and deliver engaging lessons, adapting teaching methods to student needs. Assess student progress and provide feedback. Create a positive and inclusive classroom environment.",FedEx,"{""Sector"":""Logistics"",""Industry"":""Mail, Package and Freight Delivery"",""City"":""Memphis"",""State"":""Tennessee"",""Zip"":""38120"",""Website"":""www.fedex.com"",""Ticker"":""FDX"",""CEO"":""Raj Subramaniam""}"
8,2 to 8 Years,M.Com,$65K-$102K,São Tomé,Sao Tome and Principe,0.1864,6.6131,Contract,40558,2022-09-20,Female,Chad Strickland,667.202.6824x15893,UX/UI Designer,User Interface Designer,Indeed,"User Interface Designers focus on the visual and interactive aspects of digital interfaces. They design layouts, buttons, and other elements to ensure a cohesive and visually appealing user interface.","{'Employee Assistance Programs (EAP), Tuition Reimbursement, Profit-Sharing, Transportation Benefits, Parental Leave'}","UI design principles and best practices Graphic design tools (e.g., Adobe Photoshop, Illustrator) Typography and color theory Visual design and layout Responsive design",Create visually appealing user interfaces (UI) that align with brand aesthetics and enhance user engagement. Design interface elements and interactive components. Ensure UI consistency across digital platforms.,Ryder System,"{""Sector"":""Transportation"",""Industry"":""Transportation and Logistics"",""City"":""Miami"",""State"":""Florida"",""Zip"":""33178"",""Website"":""www.ryder.com"",""Ticker"":""R"",""CEO"":""Robert E. Sanchez""}"
9,2 to 9 Years,BBA,$65K-$102K,Male,Maldives,3.2028,73.2207,Temporary,105343,2022-02-19,Female,David Hanson,+1-337-946-9956x550,UX/UI Designer,Interaction Designer,Indeed,Interaction Designers specialize in designing user interactions within digital interfaces. They create meaningful and engaging user experiences by considering user behaviors and system responses.,"{'Transportation Benefits, Professional Development, Bonuses and Incentive Programs, Profit-Sharing, Employee Discounts'}",Interaction design principles User behavior and psychology Wireframing and prototyping tools Animation and micro-interaction design Collaborative design processes,"Work on interaction design, defining how users interact with digital products and ensuring a seamless user journey. Create wireframes and prototypes to illustrate interactions. Collaborate with developers to implement interaction designs.",Zee Entertainment Enterprises,"{""Sector"":""Media & Entertainment"",""Industry"":""Media and Entertainment"",""City"":""Mumbai"",""State"":""Maharashtra"",""Zip"":""400064"",""Website"":""https://www.zeeentertainment.com/"",""Ticker"":""ZEEL"",""CEO"":""Punit Goenka""}"
10,1 to 10 Years,BBA,$60K-$80K,Saint John's,Antigua and Barbuda,17.0608,-61.7964,Full-Time,102069,2022-05-13,Both,John Nguyen,001-318-990-0531x978,Wedding Planner,Wedding Consultant,Stack Overflow Jobs,"A Wedding Consultant assists couples in planning and coordinating their weddings, helping them with vendor selection, budget management, and ensuring a seamless wedding day experience.","{'Legal Assistance, Bonuses and Incentive Programs, Wellness Programs, Employee Discounts, Retirement Plans'}",Wedding planning Vendor coordination Event management,Offer expert advice and guidance to couples planning their weddings. Assist with wedding theme and design selection. Coordinate and negotiate with vendors.,CSX,"{""Sector"":""Transportation"",""Industry"":""Railroads"",""City"":""Jacksonville"",""State"":""Florida"",""Zip"":""32202"",""Website"":""www.csx.com"",""Ticker"":""CSX"",""CEO"":""Joseph R. Hinrichs""}"
11,3 to 10 Years,BCA,$57K-$104K,Manama,Bahrain,26.0667,50.5577,Contract,130338,2023-07-01,Female,John Collier,001-683-879-1350,QA Analyst,Performance Testing Specialist,Glassdoor,"Performance Testing Specialists assess the performance of software applications by conducting load, stress, and scalability tests. They identify bottlenecks, optimize performance, and ensure software can handle user demands effectively.","{'Flexible Spending Accounts (FSAs), Relocation Assistance, Legal Assistance, Employee Recognition Programs, Financial Counseling'}",Performance testing Load testing Stress testing Test scenarios Performance monitoring Benchmarking Performance analysis,Focus on performance and load testing to assess the scalability and responsiveness of software applications. Identify bottlenecks and optimize application performance. Generate performance test reports and recommendations.,McDonald's,"{""Sector"":""Food and Beverage"",""Industry"":""Food Services"",""City"":""Chicago"",""State"":""Illinois"",""Zip"":""60607"",""Website"":""www.investor.mcdonalds.com"",""Ticker"":""MCD"",""CEO"":""Christopher J. Kempczinski""}"
12,4 to 12 Years,B.Tech,$64K-$98K,The City of Hamilton,Bermuda,32.3078,-64.7505,Contract,117285,2021-10-11,Male,Tammy Carroll,001-388-421-1960,Litigation Attorney,Family Law Attorney,Stack Overflow Jobs,"Family Law Attorneys deal with legal matters related to family relationships. They handle cases like divorce, child custody, adoption, and domestic disputes to provide legal guidance.","{'Employee Referral Programs, Financial Counseling, Health and Wellness Facilities, Casual Dress Code, Flexible Spending Accounts (FSAs)'}",Family law Divorce proceedings Child custody Mediation Legal counseling Court representation,"Specialize in family law matters, such as divorce, child custody, and adoption. Advocate for clients in family court proceedings. Offer legal advice and mediation services.",TPG Telecom,"{""Sector"":""Telecommunications"",""Industry"":""Telecommunications"",""City"":""North Sydney"",""State"":""NSW"",""Zip"":""2060"",""Website"":""https://www.tpg.com.au/"",""Ticker"":""TPG"",""CEO"":""I aki Berroeta""}"
13,3 to 15 Years,MCA,$65K-$122K,Kingston,Jamaica,18.1096,-77.2975,Part-Time,79071,2022-01-17,Both,Jennifer Moreno,200-851-9382,Mechanical Engineer,Mechanical Design Engineer,Stack Overflow Jobs,"Mechanical Design Engineers create and develop mechanical systems and components, from concept to manufacturing, ensuring functionality and safety.","{'Tuition Reimbursement, Stock Options or Equity Grants, Parental Leave, Wellness Programs, Childcare Assistance'}","Mechanical engineering CAD software (e.g., SolidWorks, AutoCAD) Finite element analysis Product development Prototyping","Design mechanical systems, components, and products. Create 3D models and detailed engineering drawings. Perform structural and thermal analyses.",ThyssenKrupp AG,"{""Sector"":""Manufacturing"",""Industry"":""Industrial Manufacturing"",""City"":""Essen"",""State"":""N/A"",""Zip"":""N/A"",""Website"":""www.thyssenkrupp.com"",""Ticker"":""TKAMY"",""CEO"":""Martina Merz""}"
14,1 to 8 Years,B.Com,$56K-$86K,Banjul,Gambia,13.4432,-15.3101,Temporary,127900,2022-05-24,Female,Lisa Franklin,(229)625-8850x6916,Network Administrator,Network Security Analyst,FlexJobs,"Protect an organizations computer networks and systems from security threats, monitor network traffic, and respond to incidents.","{'Legal Assistance, Bonuses and Incentive Programs, Wellness Programs, Employee Discounts, Retirement Plans'}",Network security protocols Intrusion detection and prevention Security incident response Firewall administration Vulnerability assessment Security policies and procedures Log analysis Ethical hacking Problem-solving Communication skills Attention to detail,"Manage and secure computer networks, including firewalls and intrusion detection systems. Monitor network traffic for security threats. Implement security policies and procedures.",EnLink Midstream,"{""Sector"":""Energy"",""Industry"":""Pipelines"",""City"":""Dallas"",""State"":""Texas"",""Zip"":""75201"",""Website"":""www.enlink.com"",""Ticker"":""ENLC"",""CEO"":""Jesse Arenivas""}"
15,1 to 9 Years,MCA,$57K-$98K,Damascus,Syrian Arab Republic,34.8021,38.9968,Full-Time,92128,2022-03-01,Male,Adam White,001-805-834-6153,Account Manager,Sales Account Manager,USAJOBS,"A Sales Account Manager is responsible for building and maintaining relationships with clients, identifying their needs, and proposing tailored solutions to achieve sales targets.","{'Casual Dress Code, Social and Recreational Activities, Employee Referral Programs, Health and Wellness Facilities, Life and Disability Insurance'}",Account management Sales strategy Negotiation and closing skills,Manage sales accounts and ensure revenue growth. Identify cross-selling and upselling opportunities. Develop account strategies and forecasts.,NGL Energy Partners,"{""Sector"":""Energy"",""Industry"":""Pipelines"",""City"":""Tulsa"",""State"":""Oklahoma"",""Zip"":""74136"",""Website"":""www.nglenergypartners.com"",""Ticker"":""NGL"",""CEO"":""Michael Krimbill""}"
16,4 to 12 Years,M.Com,$65K-$100K,Sanaa,Yemen,15.5527,48.5164,Part-Time,92028,2023-08-25,Male,Michael Graham,001-609-517-5993,Brand Manager,Product Brand Manager,SimplyHired,A Product Brand Manager focuses on promoting and managing the brand identity of specific products or product lines within a companys portfolio.,"{'Health Insurance, Retirement Plans, Flexible Work Arrangements, Employee Assistance Programs (EAP), Bonuses and Incentive Programs'}",Product branding and marketing Product lifecycle management Cross-functional team collaboration Product launch planning Market segmentation and targeting,Manage the branding of specific products or product lines. Create product launch plans and marketing campaigns. Ensure consistent product messaging and brand representation.,Bayer AG,"{""Sector"":""Pharmaceuticals"",""Industry"":""Pharmaceuticals"",""City"":""Leverkusen"",""State"":""N/A"",""Zip"":""N/A"",""Website"":""www.bayer.com"",""Ticker"":""BAYN"",""CEO"":""Werner Baumann""}"
17,5 to 14 Years,M.Tech,$60K-$83K,San Marino,San Marino,43.9424,12.4578,Part-Time,49100,2022-04-19,Male,Samuel Peterson,(434)560-6482,Social Worker,School Social Worker,Glassdoor,"Support students social and emotional well-being in schools, collaborate with educators, and connect families with resources.","{'Health Insurance, Retirement Plans, Flexible Work Arrangements, Employee Assistance Programs (EAP), Bonuses and Incentive Programs'}",School social work principles Student assessment and intervention Special education laws Individualized education plans (IEPs) Crisis management Collaboration with educators Family engagement Advocacy Empathy and communication Documentation Cultural competence Licensing and certification,Collaborate with schools to support students academic and social needs. Conduct assessments and provide counseling and resources. Advocate for students and families.,Deere,"{""Sector"":""Industrial"",""Industry"":""Construction and Farm Machinery"",""City"":""Moline"",""State"":""Illinois"",""Zip"":""61265"",""Website"":""www.deere.com"",""Ticker"":""DE"",""CEO"":""John C. May""}"
18,0 to 11 Years,BA,$55K-$117K,Papeete,French Polynesia,-17.6797,-149.4068,Full-Time,29318,2022-05-18,Male,Benjamin Lopez,(331)668-1212x28407,Social Media Coordinator,Content Creator,Jobs2Careers,"Create engaging and relevant content, such as articles, videos, or social media posts, to promote brands or products.","{'Casual Dress Code, Social and Recreational Activities, Employee Referral Programs, Health and Wellness Facilities, Life and Disability Insurance'}","Content creation (e.g., writing, editing, graphic design, video production) Content marketing Social media management SEO optimization Creative storytelling Audience engagement Analytics and reporting Adaptability Communication skills Creativity","Create compelling and shareable content for social media platforms, including text, images, and videos. Collaborate with designers and photographers for visuals. Engage with the audience and respond to comments.",Mondelez International,"{""Sector"":""Food and Beverage"",""Industry"":""Food Consumer Products"",""City"":""Chicago"",""State"":""Illinois"",""Zip"":""60607"",""Website"":""www.mondelezinternational.com"",""Ticker"":""MDLZ"",""CEO"":""Dirk Van De Put""}"
19,3 to 12 Years,BA,$55K-$121K,Seoul,North Korea,40.3399,127.5101,Contract,126630,2021-12-29,Female,Adam Anderson,459-591-7982x348,Email Marketing Specialist,Deliverability Analyst,Internships.com,"Monitor and improve email deliverability rates, troubleshoot delivery issues, and maintain a clean email list.","{'Employee Referral Programs, Financial Counseling, Health and Wellness Facilities, Casual Dress Code, Flexible Spending Accounts (FSAs)'}","Email deliverability best practices Spam filter testing List hygiene Blacklist monitoring Email authentication (e.g., SPF, DKIM) Deliverability metrics analysis Troubleshooting deliverability issues Communication skills Data analysis Attention to detail","Focus on email deliverability, monitoring email sender reputation and list quality. Troubleshoot email delivery issues and maintain sender compliance. Implement best practices for inbox placement.",3M,"{""Sector"":""Conglomerate"",""Industry"":""Chemicals"",""City"":""St. Paul"",""State"":""Minnesota"",""Zip"":""55144"",""Website"":""www.3m.com"",""Ticker"":""MMM"",""CEO"":""Michael F. Roman""}"
20,5 to 9 Years,PhD,$65K-$128K,Kinshasa,Democratic Republic Of Congo,-4.0383,21.7587,Temporary,48199,2022-07-27,Female,Jason Cook,(961)330-3515x6191,HR Generalist,HR Coordinator,Snagajob,"HR Coordinators assist in HR functions such as recruitment, onboarding, and employee record maintenance. They often handle administrative tasks, organize training programs, and provide support to the HR department in various ways.","{'Health Insurance, Retirement Plans, Flexible Work Arrangements, Employee Assistance Programs (EAP), Bonuses and Incentive Programs'}",Human resources Recruitment Employee onboarding HRIS (HR Information Systems) Record keeping Communication skills,"Assist with recruitment activities, including posting job openings, coordinating interviews, and managing applicant data. Ensure a positive candidate experience. Maintain recruitment records and metrics.",KKR,"{""Sector"":""Financials"",""Industry"":""Securities"",""City"":""New York"",""State"":""New York"",""Zip"":""10001"",""Website"":""www.kkr.com"",""Ticker"":""KKR"",""CEO"":""Joseph Y. Bae""}"
21,0 to 15 Years,B.Tech,$62K-$120K,Baku,Azerbaijan,40.1431,47.5769,Full-Time,64351,2022-02-13,Both,Cassandra Allen,(804)907-1226,Legal Assistant,Legal Secretary,The Muse,"Provide administrative support to legal professionals, manage schedules, draft documents, and handle correspondence.","{'Employee Assistance Programs (EAP), Tuition Reimbursement, Profit-Sharing, Transportation Benefits, Parental Leave'}","Legal administrative tasks Document management Calendar and docketing Transcription File organization Communication with clients and courts Knowledge of legal terminology Attention to detail Multitasking Computer skills (e.g., MS Office)","Provide administrative support to legal professionals, including scheduling appointments and managing calendars. Prepare legal correspondence and forms. Maintain legal databases and records.",NGL Energy Partners,"{""Sector"":""Energy"",""Industry"":""Pipelines"",""City"":""Tulsa"",""State"":""Oklahoma"",""Zip"":""74136"",""Website"":""www.nglenergypartners.com"",""Ticker"":""NGL"",""CEO"":""Michael Krimbill""}"
22,0 to 10 Years,BCA,$64K-$98K,Funafuti,Tuvalu,-7.1095,177.6493,Intern,118041,2023-09-03,Both,Michael Wood,539.214.7150,Nurse Practitioner,Family Nurse Practitioner,Dice,"Family Nurse Practitioners specialize in family-centered healthcare, providing comprehensive medical care to individuals of all ages within a family context.","{'Childcare Assistance, Paid Time Off (PTO), Relocation Assistance, Flexible Work Arrangements, Professional Development'}",Family medicine Health assessment Pediatric care Chronic disease management Patient education,"Focus on family-centered care, providing healthcare services to individuals and families of all ages. Perform physical exams, order diagnostic tests, and manage chronic conditions. Promote health and wellness.",EasyJet,"{""Sector"":""Travel and Leisure"",""Industry"":""Airlines"",""City"":""London"",""State"":""N/A"",""Zip"":""N/A"",""Website"":""www.easyjet.com"",""Ticker"":""EZJ"",""CEO"":""Johan Lundgren""}"
23,1 to 8 Years,M.Tech,$58K-$116K,Asmara,Eritrea,15.1794,39.7823,Intern,40723,2023-08-26,Male,Joel Barr,824-556-0769,Account Director,Account Strategist,USAJOBS,"Account Strategists work in advertising or marketing agencies, managing client accounts. They develop strategies to meet client goals, oversee campaign execution, and maintain client satisfaction by providing expert guidance and solutions.","{'Health Insurance, Retirement Plans, Paid Time Off (PTO), Flexible Work Arrangements, Employee Assistance Programs (EAP)'}",Account management Client relations Marketing strategies Campaign optimization Data analysis Communication skills,Develop account strategies and marketing plans to achieve client objectives. Analyze campaign performance data and provide strategic recommendations. Collaborate with cross-functional teams.,Otis Worldwide,"{""Sector"":""Elevators & Escalators"",""Industry"":""Industrial Machinery"",""City"":""Farmington"",""State"":""Connecticut"",""Zip"":""6032"",""Website"":""www.otis.com"",""Ticker"":""OTIS"",""CEO"":""Judith F. Marks""}"
