Job Id,Experience,Qualifications,Salary Range,location,Country,latitude,longitude,Work Type,Company Size,Job Posting Date,Preference,Contact Person,Contact,Job Title,Role,Job Portal,Job Description,Benefits,skills,Responsibilities,Company,Company Profile
24,2 to 14 Years,PhD,$62K-$124K,Tegucigalpa,Honduras,15.199,-86.2419,Temporary,127385,2022-07-03,Both,Danny Nelson,3185179288,Software Engineer,Backend Developer,CareerBuilder,"A Backend Developer is tasked with building and maintaining the server-side logic and database infrastructure of web applications. They work on the core functionality, data storage, and server communication to ensure the application runs smoothly and efficiently.","{'Employee Assistance Programs (EAP), Tuition Reimbursement, Profit-Sharing, Transportation Benefits, Parental Leave'}","Proficiency in one or more backend programming languages (e.g., Java, Python, Node.js, Ruby) API development Database management (SQL or NoSQL) Server management and deployment Security best practices Knowledge of web frameworks (e.g., Express, Django)","Develop server-side logic and databases using programming languages like Java, Python, or Node.js. Ensure data security and integrity. Implement APIs for seamless communication between frontend and backend.",Oil Search,"{""Sector"":""Energy/Oil and Gas"",""Industry"":""Oil & Gas"",""City"":""Sydney"",""State"":""NSW"",""Zip"":""2000"",""Website"":""https://www.oilsearch.com/"",""Ticker"":""OSH"",""CEO"":""Keiran Wulff""}"
25,3 to 9 Years,MBA,$60K-$104K,Road Town,British Virgin Islands,18.4207,-64.6399,Temporary,28043,2023-08-02,Both,Brandon Rodriguez,455.542.4718x49154,Purchasing Agent,Supply Chain Coordinator,Jobs2Careers,"A Supply Chain Coordinator manages supply chain operations, coordinates logistics, and ensures the seamless flow of goods and materials throughout the supply chain network.","{'Legal Assistance, Bonuses and Incentive Programs, Wellness Programs, Employee Discounts, Retirement Plans'}",Supply chain logistics Inventory management Communication skills Problem-solving Vendor coordination,"Coordinate supply chain activities, including logistics, transportation, and demand planning. Collaborate with suppliers and distribution partners. Monitor and improve supply chain efficiency.",HCL Technologies,"{""Sector"":""Information Technology"",""Industry"":""Information Technology and Services"",""City"":""Noida"",""State"":""Uttar Pradesh"",""Zip"":""201301"",""Website"":""https://www.hcltech.com/"",""Ticker"":""HCLTECH"",""CEO"":""C. Vijayakumar""}"
26,4 to 12 Years,BBA,$58K-$107K,Havana,Cuba,21.5218,-77.7812,Temporary,81318,2021-11-16,Female,Michael Barrera,569-301-0454x8884,Purchasing Agent,Supply Chain Coordinator,The Muse,"A Supply Chain Coordinator manages supply chain operations, coordinates logistics, and ensures the seamless flow of goods and materials throughout the supply chain network.","{'Tuition Reimbursement, Stock Options or Equity Grants, Parental Leave, Wellness Programs, Childcare Assistance'}",Supply chain logistics Inventory management Communication skills Problem-solving Vendor coordination,"Coordinate supply chain activities, including logistics, transportation, and demand planning. Collaborate with suppliers and distribution partners. Monitor and improve supply chain efficiency.",DTE Energy,"{""Sector"":""Utilities"",""Industry"":""Utilities: Gas and Electric"",""City"":""Detroit"",""State"":""Michigan"",""Zip"":""48226"",""Website"":""www.dteenergy.com"",""Ticker"":""DTE"",""CEO"":""Gerardo Norcia""}"
27,5 to 15 Years,M.Tech,$59K-$88K,Budapest,Hungary,47.1625,19.5033,Contract,105370,2022-11-28,Male,Jacqueline Elliott,706.814.2969x12242,Sales Consultant,B2B Sales Consultant,Jobs2Careers,"B2B Sales Consultants specialize in business-to-business sales. They identify and target potential corporate clients, negotiate contracts, and build long-term relationships to drive sales growth in the B2B market.","{'Health Insurance, Retirement Plans, Flexible Work Arrangements, Employee Assistance Programs (EAP), Bonuses and Incentive Programs'}",B2B sales Business-to-business sales strategies Lead generation Sales negotiations Client relationship building Market research,"Specialize in business-to-business (B2B) sales, targeting corporate clients. Build and maintain long-term relationships with key clients. Negotiate and close complex sales deals.",Associated British Foods,"{""Sector"":""Food and Beverage"",""Industry"":""Food and Beverage"",""City"":""London"",""State"":""N/A"",""Zip"":""N/A"",""Website"":""www.abf.co.uk"",""Ticker"":""ABF"",""CEO"":""George Weston""}"
28,4 to 15 Years,BA,$64K-$100K,Banjul,Gambia,13.4432,-15.3101,Part-Time,51537,2023-01-23,Male,William White,+1-806-627-7453x10589,Civil Engineer,Structural Engineer,Internships.com,"A Structural Engineer designs and analyzes the structural integrity of buildings, bridges, and other structures. They ensure safety and compliance with engineering standards.","{'Health Insurance, Retirement Plans, Flexible Work Arrangements, Employee Assistance Programs (EAP), Bonuses and Incentive Programs'}","Structural engineering principles Structural analysis and design software (e.g., AutoCAD, SAP2000) Building codes and standards Project management Structural integrity assessment",Design and analyze structural components and systems for buildings and infrastructure projects. Ensure structural safety and compliance with codes and standards. Collaborate with architects and contractors.,Xcel Energy,"{""Sector"":""Utilities"",""Industry"":""Utilities: Gas and Electric"",""City"":""Minneapolis"",""State"":""Minnesota"",""Zip"":""55401"",""Website"":""www.xcelenergy.com"",""Ticker"":""XEL"",""CEO"":""Bob Frenzel""}"
29,0 to 12 Years,M.Com,$63K-$86K,Funafuti,Tuvalu,-7.1095,177.6493,Intern,93670,2023-01-21,Female,Patrick Adams,(662)694-6094x18865,Network Security Specialist,Security Operations Center (SOC) Analyst,Indeed,"SOC Analysts work in security operations centers. They monitor and respond to security incidents, analyze threats, and implement security protocols to protect an organizations assets.","{'Health Insurance, Retirement Plans, Flexible Work Arrangements, Employee Assistance Programs (EAP), Bonuses and Incentive Programs'}","SOC operations Security incident response Threat detection Log analysis Security tools (e.g., IDS/IPS) Security alerts triage",Work in SOC teams to monitor and respond to security incidents. Investigate and analyze security alerts and incidents. Maintain security documentation and incident reports.,Deutsche Post DHL Group,"{""Sector"":""Logistics"",""Industry"":""Logistics & Delivery Services"",""City"":""Bonn"",""State"":""N/A"",""Zip"":""N/A"",""Website"":""www.dpdhl.com"",""Ticker"":""DPW"",""CEO"":""Frank Appel""}"
30,2 to 10 Years,BBA,$65K-$119K,Asunción,Paraguay,-23.442503,-58.443832,Intern,56930,2023-06-06,Female,Stephanie Robinson,+1-953-807-7846x20627,UI Developer,Front-End Developer,Idealist,A Front-End Developer specializes in creating the user interface and user experience of websites or applications. They code and design elements that users interact with directly.,"{'Casual Dress Code, Social and Recreational Activities, Employee Referral Programs, Health and Wellness Facilities, Life and Disability Insurance'}","Front-end web development HTML, CSS, JavaScript Responsive design Web performance optimization Cross-browser compatibility","Develop and maintain user interfaces for websites and web applications. Write clean and efficient HTML, CSS, and JavaScript code. Collaborate with UX designers to ensure a seamless user experience.",Bodycote,"{""Sector"":""Engineering"",""Industry"":""Manufacturing - Diversified"",""City"":""Macclesfield"",""State"":""England"",""Zip"":""SK10 2XD"",""Website"":""https://www.bodycote.com/"",""Ticker"":""BOY"",""CEO"":""Stephen Harris""}"
31,4 to 8 Years,BA,$55K-$83K,Amman,Jordan,30.5852,36.2384,Intern,64185,2023-03-19,Female,Daniel Clark,001-692-803-8841x5346,Financial Planner,Tax Planner,FlexJobs,"Assist clients with tax planning, minimize tax liabilities, and stay up-to-date with tax laws and regulations.","{'Employee Assistance Programs (EAP), Tuition Reimbursement, Profit-Sharing, Transportation Benefits, Parental Leave'}",Tax planning strategies Tax law knowledge Financial analysis Retirement planning Estate planning Client relationship management Tax optimization Communication skills Attention to detail Tax software proficiency Regulatory compliance,"Focus on tax planning and optimization, helping clients minimize tax liabilities. Stay updated on tax laws and regulations. Provide tax-efficient financial strategies.",Old Republic International,"{""Sector"":""Insurance"",""Industry"":""Insurance: Property and Casualty (Stock)"",""City"":""Chicago"",""State"":""Illinois"",""Zip"":""60601"",""Website"":""www.oldrepublic.com"",""Ticker"":""ORI"",""CEO"":""Craig R. Smiddy""}"
32,3 to 8 Years,BA,$65K-$115K,Santiago,Chile,-35.6751,-71.5429,Part-Time,101834,2023-06-01,Both,William Thompson,001-572-717-9634x34519,Event Planner,Event Coordinator,USAJOBS,"Event Coordinators plan and execute various events, including conferences, parties, and meetings, managing logistics, budgets, and vendor relationships.","{'Casual Dress Code, Social and Recreational Activities, Employee Referral Programs, Health and Wellness Facilities, Life and Disability Insurance'}",Event planning Vendor coordination Budget management Marketing and promotion Logistics,"Plan and coordinate events, including logistics, vendor management, and timelines. Communicate with clients to understand event goals and preferences. Ensure smooth event execution.",United Airlines Holdings,"{""Sector"":""Airlines"",""Industry"":""Airlines"",""City"":""Chicago"",""State"":""Illinois"",""Zip"":""60606"",""Website"":""www.united.com"",""Ticker"":""UAL"",""CEO"":""Scott Kirby""}"
33,1 to 14 Years,M.Com,$57K-$121K,Abuja,Nigeria,9.082,8.6753,Contract,130962,2022-02-05,Female,Richard Miller,001-434-257-5741x5922,Psychologist,Clinical Psychologist,Jobs2Careers,"Clinical Psychologists diagnose and treat mental health disorders. They conduct therapy sessions, assessments, and research to improve patients well-being.","{'Employee Assistance Programs (EAP), Tuition Reimbursement, Profit-Sharing, Transportation Benefits, Parental Leave'}",Clinical psychology Counseling skills Assessment tools Diagnostic skills Empathy and listening skills,"Provide therapy and counseling services to individuals, couples, and families. Conduct psychological assessments and diagnoses. Develop treatment plans and provide ongoing support.",Tenet Healthcare,"{""Sector"":""Healthcare"",""Industry"":""Health Care: Medical Facilities"",""City"":""Dallas"",""State"":""Texas"",""Zip"":""75254"",""Website"":""www.tenethealth.com"",""Ticker"":""THC"",""CEO"":""Saum Sutaria""}"
34,1 to 13 Years,B.Com,$65K-$82K,Tripoli,Libya,26.3351,17.2283,Contract,38044,2023-03-27,Male,Jacob Mccoy,+1-693-442-1606x17267,Electrical Designer,Electrical Engineer,Indeed,"Electrical Engineers design and develop electrical systems and devices. They work on projects such as power generation, electronics, and control systems for various industries.","{'Employee Assistance Programs (EAP), Tuition Reimbursement, Profit-Sharing, Transportation Benefits, Parental Leave'}",Electrical engineering Circuit design Electronics AutoCAD proficiency Problem-solving,Design electrical systems and components for buildings and infrastructure projects. Ensure compliance with electrical codes and safety standards. Collaborate with architects and contractors.,Regions Financial,"{""Sector"":""Financials"",""Industry"":""Commercial Banks"",""City"":""Birmingham"",""State"":""Alabama"",""Zip"":""35203"",""Website"":""www.regions.com"",""Ticker"":""RF"",""CEO"":""John M. Turner Jr.""}"
35,0 to 8 Years,M.Com,$62K-$130K,Canberra,Australia,-25.2744,133.7751,Temporary,27725,2022-11-02,Both,Brian Jackson,(504)867-7406,Electrical Designer,Lighting Designer,Idealist,"Lighting Designers create lighting plans for architectural and artistic purposes. They enhance spaces with lighting effects, aesthetics, and energy-efficient lighting solutions.","{'Life and Disability Insurance, Stock Options or Equity Grants, Employee Recognition Programs, Health Insurance, Social and Recreational Activities'}",Lighting design Architectural lighting Lighting software proficiency Creative lighting concepts Technical knowledge,"Specialize in lighting design, creating lighting plans for interiors and exteriors. Select lighting fixtures and systems. Enhance visual appeal and energy efficiency through lighting design.",CBRE Group,"{""Sector"":""Real Estate"",""Industry"":""Real Estate"",""City"":""Dallas"",""State"":""Texas"",""Zip"":""75201"",""Website"":""www.cbre.com"",""Ticker"":""CBRE"",""CEO"":""""}"
36,3 to 10 Years,M.Com,$58K-$129K,Noumea,New Caledonia,-20.9043,165.618,Part-Time,35273,2023-08-31,Female,Albert Adams,3544119013,Data Analyst,Business Intelligence Analyst,Idealist,"Business Intelligence Analysts gather and analyze data to provide valuable insights to support decision-making within an organization. They create reports, dashboards, and data visualizations to help stakeholders understand trends, patterns, and opportunities in the data.","{'Employee Referral Programs, Financial Counseling, Health and Wellness Facilities, Casual Dress Code, Flexible Spending Accounts (FSAs)'}","Data analysis and visualization tools (e.g., Tableau, Power BI) SQL and database querying Business intelligence concepts Data modeling and reporting Strong analytical and problem-solving skills Data-driven decision-making",Gather and analyze data to provide insights for decision-making using tools like Tableau or Power BI. Create data visualizations and reports. Identify trends and patterns in data.,"Wyndham Hotels & Resorts, Inc.","{""Sector"":""Hospitality/Hotels"",""Industry"":""Travel and Leisure - Hotels"",""City"":""Parsippany"",""State"":""NJ"",""Zip"":""7054"",""Website"":""https://www.wyndhamhotels.com/"",""Ticker"":""WH"",""CEO"":""Geoff Ballotti""}"
37,0 to 12 Years,PhD,$60K-$89K,Muscat,Oman,21.4735,55.9754,Intern,103693,2022-02-06,Male,Michael Sanchez,001-274-892-4436x23754,Technical Writer,Content Writer,USAJOBS,"Content Writers create written content for various platforms. They produce articles, blog posts, and web content to inform, educate, or entertain audiences.","{'Legal Assistance, Bonuses and Incentive Programs, Wellness Programs, Employee Discounts, Retirement Plans'}",Writing skills Content creation SEO knowledge Research skills Grammar and proofreading,"Write informative and engaging content for websites, blogs, and marketing materials. Conduct research and interviews to gather information. Tailor content to target audiences.",Corning,"{""Sector"":""Technology"",""Industry"":""Electronics, Electrical Equip."",""City"":""Corning"",""State"":""New York"",""Zip"":""14831"",""Website"":""www.corning.com"",""Ticker"":""GLW"",""CEO"":""Wendell P. Weeks""}"
38,0 to 8 Years,BA,$64K-$103K,Gaza,West Bank and Gaza,31.9522,35.2332,Temporary,29884,2022-02-25,Female,Charles Cooper,+1-464-554-3555,UX/UI Designer,User Interface Designer,Internships.com,"User Interface Designers focus on the visual and interactive aspects of digital interfaces. They design layouts, buttons, and other elements to ensure a cohesive and visually appealing user interface.","{'Casual Dress Code, Social and Recreational Activities, Employee Referral Programs, Health and Wellness Facilities, Life and Disability Insurance'}","UI design principles and best practices Graphic design tools (e.g., Adobe Photoshop, Illustrator) Typography and color theory Visual design and layout Responsive design",Create visually appealing user interfaces (UI) that align with brand aesthetics and enhance user engagement. Design interface elements and interactive components. Ensure UI consistency across digital platforms.,Leidos Holdings,"{""Sector"":""IT Services"",""Industry"":""Information Technology Services"",""City"":""Reston"",""State"":""Virginia"",""Zip"":""20190"",""Website"":""www.leidos.com"",""Ticker"":""LDOS"",""CEO"":""Thomas A. Bell""}"
39,4 to 12 Years,M.Com,$57K-$100K,Honiara,Solomon Islands,-9.6457,160.1562,Part-Time,104700,2023-01-15,Male,Christina Combs,965.530.9607,Tax Consultant,Personal Tax Consultant,Snagajob,A Personal Tax Consultant provides tax planning and preparation services to individuals. They help clients optimize their tax situations while ensuring compliance with tax laws.,"{'Casual Dress Code, Social and Recreational Activities, Employee Referral Programs, Health and Wellness Facilities, Life and Disability Insurance'}",Tax law knowledge Individual tax planning Tax return preparation Tax deductions and credits Tax compliance IRS regulations Client relationship management Communication skills Attention to detail Tax software proficiency,Assist individuals and families with personal income tax planning and compliance. Prepare and file tax returns. Provide tax advice and financial planning.,Divi's Laboratories,"{""Sector"":""Pharmaceuticals"",""Industry"":""Pharmaceuticals"",""City"":""Hyderabad"",""State"":""Telangana"",""Zip"":""500090"",""Website"":""https://www.divislabs.com/"",""Ticker"":""DIVISLAB"",""CEO"":""Murali K. Divi""}"
40,5 to 10 Years,MBA,$58K-$81K,São Tomé,Sao Tome and Principe,0.1864,6.6131,Full-Time,47107,2023-02-09,Both,Alexis Smith,(881)891-1324,Software Tester,Automation Tester,Internships.com,An Automation Tester uses automated testing tools to verify the functionality and performance of software applications. They create and execute automated test scripts.,"{'Employee Referral Programs, Financial Counseling, Health and Wellness Facilities, Casual Dress Code, Flexible Spending Accounts (FSAs)'}","Test automation tools (e.g., Selenium, Appium) Scripting languages (e.g., Python, Java) Test framework development Continuous integration tools Test data management",Implement and maintain test automation frameworks. Write automated test scripts for regression testing. Analyze test results and provide feedback for continuous improvement.,Tata Consumer Products,"{""Sector"":""Consumer Goods"",""Industry"":""Consumer Goods"",""City"":""Mumbai"",""State"":""Maharashtra"",""Zip"":""400099"",""Website"":""https://www.tataconsumer.com/"",""Ticker"":""TATACON"",""CEO"":""Sunil D'Souza""}"
41,5 to 14 Years,BCA,$56K-$109K,Yamoussoukro,Cote d'Ivoire,7.54,-5.5471,Intern,61246,2023-06-15,Male,Kenneth Nichols,001-826-432-1572,Account Executive,Sales Account Executive,Internships.com,"A Sales Account Executive is responsible for acquiring and managing business accounts. They identify sales opportunities, negotiate contracts, and meet revenue targets.","{'Flexible Spending Accounts (FSAs), Relocation Assistance, Legal Assistance, Employee Recognition Programs, Financial Counseling'}",Sales strategies and tactics Account management Relationship building Sales forecasting Industry and product knowledge,Identify and pursue sales opportunities with new and existing clients. Build and maintain client relationships. Meet or exceed sales targets and quotas.,Fannie Mae,"{""Sector"":""Financial Services"",""Industry"":""Diversified Financials"",""City"":""Washington"",""State"":""District of Columbia"",""Zip"":""20005"",""Website"":""www.fanniemae.com"",""Ticker"":""FNMA"",""CEO"":""Priscilla Almodovar""}"
42,2 to 13 Years,BCA,$55K-$121K,Quito,Ecuador,-1.8312,-78.1834,Part-Time,43665,2022-03-30,Both,William Beck,+1-858-640-0577x979,Systems Administrator,IT Support Specialist,SimplyHired,"IT Support Specialists provide technical assistance to end-users, troubleshooting hardware and software problems, setting up equipment, and maintaining IT infrastructure.","{'Transportation Benefits, Professional Development, Bonuses and Incentive Programs, Profit-Sharing, Employee Discounts'}",Technical troubleshooting Hardware and software support Customer service Problem-solving Communication,"Provide technical support to end-users, troubleshoot hardware and software issues, and resolve IT-related problems. Install and configure computer systems and software. Maintain IT documentation and knowledge base.",Spotify Technology S.A.,"{""Sector"":""Technology/Music Streaming"",""Industry"":""Entertainment - Music Streaming"",""City"":""Stockholm, Sweden"",""State"":""N/A"",""Zip"":""N/A"",""Website"":""https://www.spotify.com/"",""Ticker"":""SPOT"",""CEO"":""Daniel Ek""}"
43,4 to 9 Years,BA,$62K-$129K,Charlotte Amalie,Virgin Islands (U.S.),18.3358,-64.8963,Intern,125427,2022-05-30,Female,Justin Escobar,(302)230-3896,Account Director,Account Strategist,SimplyHired,"Account Strategists work in advertising or marketing agencies, managing client accounts. They develop strategies to meet client goals, oversee campaign execution, and maintain client satisfaction by providing expert guidance and solutions.","{'Employee Assistance Programs (EAP), Tuition Reimbursement, Profit-Sharing, Transportation Benefits, Parental Leave'}",Account management Client relations Marketing strategies Campaign optimization Data analysis Communication skills,Develop account strategies and marketing plans to achieve client objectives. Analyze campaign performance data and provide strategic recommendations. Collaborate with cross-functional teams.,Bajaj Auto,"{""Sector"":""Automotive"",""Industry"":""Automotive"",""City"":""Pune"",""State"":""Maharashtra"",""Zip"":""411035"",""Website"":""https://www.bajajauto.com/"",""Ticker"":""BAJAJ-AUTO"",""CEO"":""Rakesh Sharma""}"
44,0 to 10 Years,PhD,$65K-$95K,Yaounde,Cameroon,7.3697,12.3547,Part-Time,57134,2021-10-28,Both,Vickie Williams,596-930-1925,Digital Marketing Specialist,Social Media Manager,FlexJobs,"Social Media Managers oversee an organizations social media presence. They create and schedule content, engage with followers, and analyze social media metrics to drive brand awareness and engagement.","{'Flexible Spending Accounts (FSAs), Relocation Assistance, Legal Assistance, Employee Recognition Programs, Financial Counseling'}","Social media platforms (e.g., Facebook, Twitter, Instagram) Content creation and scheduling Social media analytics and insights Community engagement Paid social advertising","Manage and grow social media accounts, create engaging content, and interact with the online community. Develop social media content calendars and strategies. Monitor social media trends and engagement metrics.",Renishaw,"{""Sector"":""Manufacturing"",""Industry"":""Engineering/Industrial Equipment"",""City"":""Wotton-under-Edge"",""State"":""England"",""Zip"":""GL12 8JR"",""Website"":""https://www.renishaw.com/"",""Ticker"":""RSW"",""CEO"":""William Lee""}"
45,1 to 15 Years,BBA,$56K-$82K,Yaounde,Cameroon,7.3697,12.3547,Temporary,55648,2023-08-05,Female,Timothy Morrison,4603293430,Database Administrator,Database Developer,CareerBuilder,"A Database Developer designs, develops, and maintains databases. They create efficient data structures, write queries, and ensure data security and integrity.","{'Tuition Reimbursement, Stock Options or Equity Grants, Parental Leave, Wellness Programs, Childcare Assistance'}","Database design and development SQL and database querying Data modeling Programming languages (e.g., Java, Python) Data security and privacy regulations knowledge","Design and implement database systems, tables, and structures. Develop and optimize SQL queries and scripts. Ensure data security, integrity, and backup procedures.",News Corp.,"{""Sector"":""Media"",""Industry"":""Publishing, Printing"",""City"":""New York"",""State"":""New York"",""Zip"":""10036"",""Website"":""www.newscorp.com"",""Ticker"":""NWSA"",""CEO"":""Robert J. Thomson""}"
46,1 to 15 Years,B.Tech,$59K-$80K,Moroni,Comoros,-11.6455,43.3333,Intern,107738,2022-02-19,Both,Christy Willis,300.958.3106x000,Research Analyst,Social Science Researcher,Idealist,"A Social Science Researcher conducts research in fields such as sociology, psychology, or anthropology to study human behavior and social phenomena, contributing to academic knowledge.","{'Flexible Spending Accounts (FSAs), Relocation Assistance, Legal Assistance, Employee Recognition Programs, Financial Counseling'}","Social science research methods Qualitative and quantitative data analysis Survey design and implementation Ethnographic research Interviewing skills Research ethics Statistical software (e.g., Stata, NVivo) Report writing Communication skills Critical thinking Empathy","Conduct research in social sciences, gathering and analyzing data on social phenomena, human behavior, and public policy. Publish research findings in academic journals. Contribute to social science research projects.",KKR,"{""Sector"":""Financials"",""Industry"":""Securities"",""City"":""New York"",""State"":""New York"",""Zip"":""10001"",""Website"":""www.kkr.com"",""Ticker"":""KKR"",""CEO"":""Joseph Y. Bae""}"
47,3 to 9 Years,B.Tech,$56K-$109K,Madrid,Spain,40.4637,-3.7492,Temporary,91636,2023-05-29,Male,Terri Grant,540.498.7736,Data Entry Clerk,Record Keeper,Jobs2Careers,"A Record Keeper is responsible for maintaining accurate records and databases, ensuring data integrity, and assisting in data retrieval when needed.","{'Legal Assistance, Bonuses and Incentive Programs, Wellness Programs, Employee Discounts, Retirement Plans'}",Records management Data entry and retrieval Attention to detail,"Maintain records, files, and documentation in an organized manner. Ensure compliance with record-keeping policies and regulations. Retrieve and update records as needed.",Arconic,"{""Sector"":""Manufacturing"",""Industry"":""Metals"",""City"":""Pittsburgh"",""State"":""Pennsylvania"",""Zip"":""15212"",""Website"":""www.arconic.com"",""Ticker"":""ARNC"",""CEO"":""Timothy D. Myers""}"
